I've become a bitter person. What's the point of putting on a fake smile if I don't appreciate anyone. ,sadness,,
"I don't care about you, fuck you! ",fear,,
"my shock has finally started to fade, and i can now say this: jim Magic IGNORED me yesterday, he was too busy chatting with hanna… ",sadness,,
"It is wise to direct your towards problems - not people, to focus your #energies on answers - not #excuses. ",anger,,
I fear no one but Allah. And i put my most of my trust in Allah.  #Hope,fear,,
Guess I am not gonna hear from my baby tonight :( ,sadness,,
Ever since I got this job I haven't on twitter I feel like I'm Misses Sooo Much Stuff I miss my Followers ,sadness,,
"N-SULATE  You can be the protecting cushion between those you lead, and the forces of &amp; failure. #churchspeaker  #fb #dad",fear,,
Righteous never BLOWS UP or CLAMS UP. It surveys the situation &amp; obeys GOD in spite of satanic aggravation.,anger,,
A gloriously late morning with the children. They are being well-behaved. WHAT ARE THEY PLANNING? ,fear,,
Holy fuck this knee pain is excruciating since this nerve block wore off. ,sadness,,
Just got sick....ewww and I was kinda looking forward to basketball damn flu :(,sadness,,
"The racist woman on the tram made a fool of herself, what an ignorant idiot &amp; to swear infront of your little child like that smh! ",disgust,,
Hot guy isn't here today... :'(,sadness,,
Reminiscing on good times by looking through pictures. I remember all our jokes and the day we met. We used to be inseperable! ,sadness,,
I can only listen to Death Cab fro Cutie for short periods of times. ,sadness,,
"phones getting fixed finally, this is why you shouldn't whip your phone at a wall... ",anger,,
"Jus kno tht Im in debt for u, defendin all our dreams.. i hope u tell ur Families this Shit aint wat it Seems..I got u  havno ",fear,,
Funeral tomorrow oh gosh! :(,sadness,,
&quot;awwww look at the baby cows running!&quot; &quot;yeah in about a year they'll be your steak.&quot; ,sadness,,
Though I've never wished to enter two  in a single day  and  is worth the I felt for society,sadness,,
ain't america grand let's all be thankful for what we have cause it's shiny and they told us we'll like it on TEEVEE ,fear,,
" IF you DO piss of young hot mark wahlberg, your dogs head will get cut off and put thru the doggy door... ",fear,,
 Dickinson said: as soon as fed is dead --It's starving makes it fat.&#xA;#wisdom,anger,,
Wanna watch happy feet 2! Sana idate naman ako ni Justin. Sobrang busy na lagi eh :( ,sadness,,
I miss my boyfriendn I couldnt talk to him because of finals. ,sadness,,
"Sending my new lens back and saving up for a 35mm. Have to keep repeating to myself.. &quot;It's just a 'thing', it's just a 'thing'&quot; ",sadness,,
When you're attached to someone; your self-seeking nature &amp; insecurity would not let them go be &amp; do what they are meant to be or do ,fear,,
went to the mva to get my license to find out that im scheduled to take it next week and nobody can take me then. ,anger,,
i miss my long hair. ): ,sadness,,
What. The. Fuck. So ready for this semester to be over. ,anger,,
"In other news, due to forgetting a belt and a long coat that impedes hitching, these jeans are one walk wiggle from hitting the deck. ",fear,,
yuck! Twitter don't need to know about your period life ma'am! ,disgust,,
I don't mind if i see a spider in my house...i only mind once it disappears ,fear,,
is the weapon of choice used by bullies &amp; cowards who feel powerless-2 control &amp; manipulate others 4 their own means,fear,,
I haven't stopped eating all weekend.. or..?,sadness,,
"No longer your prison, today I remember who I was then now is gone. ",fear,,
"Note to self: Never transport hot items in crock pots via car, unless you want a permanent spiced cider scent in your Mazda. #fb",sadness,,
is False evidence appearing real shared via a FB #friend! Such #truth!,fear,,
What a heart-wrenching story that was. Such a beautiful little boy. His heart just wasn't strong enough. #60Minutes,sadness,,
Boyfriend flew to Chicago today to appraise a comic book collection. ,sadness,,
Nothing would satisfy me more then to see the light leave his eyes and to know he no longer draws breath ,anger,,
"work,work,work,work, fucking job ",sadness,,
Dans un taxi avec une conductrice dingue. Discours sans queue ni tête. J'avais juste demandé si ça roulait sur le périf. ,fear,,
The local library web site is down. Now I can't see if the book I put a hold on is in yet :-( ,sadness,,
voting in america is like eating corn kernels: why bother to input when the shit coming out shows the input undigested?  #usa,fear,,
"when a ride is on the bus, you get a new love for him then they get off and you'll never know anything about him or see him again!",sadness,,
"How dare we let it motivate us, how dare we let it into our decision making, into our lively hoods, into our relationships.",fear,,
Domani vado allo stadio a vedere il  .. L'  quest'anno non la guardo più.. Mette solo  ,sadness,,
management = emotional repression,anger,,
"when you run out of the thing you want,and youre broke. ",sadness,,
Bye Alec! I'll miss you so much. Have fun in Belize. ,sadness,,
 we have breakfast for lunch at school....  oh wait...  we never do ,sadness,,
Dude I was wearing petticoat breeches before they were cool.   #rhinegraves #dumbMusic #TheYearOfOurLord1665,sadness,,
Can't wait for my Everlast pink heavy bag  ,anger,,
GoDaddy's database feature is so broken.  #MAD #MORERAGE,anger,,
Will love ever come her way? Can a man find his way into her heart? &quot;Afraid Of Love&quot; s     #read #dreams,fear,,
My mother made breakfast this morning and I missed it.... ,sadness,,
"I did a very nice thing last night, but as I spent so long on it, I now have no time for all the work I need to do ",fear,,
Oi. This bride on  Big Bliss is in srs denial about her body. You can gain inches but not gain pounds. TRUFAX. #awkward,sadness,,
make that 6 fire alarms in one night. fuck you derwent. ,anger,,
"&quot;and #Love r powerful motivating forces. One inspires selfishness, the other altruism.&quot;",fear,,
"Ewww , Ya Grind Prolli A Messss ! & years yu havent been to da dentist . !!",disgust,,
is built from disconnection fron the Source who provides peace,anger,,
Sick of school! Miss my free time and cnt play ball bc of grades ,sadness,,
"Going to bed... with thoughts I can't get off my mind. Sadly, avoiding them this time around isn't going to work. #issues #life",sadness,,
Hate how weak my nails are!!!! Had to cut them all each one of them were breaking :( #manicureNEEDED,sadness,,
"I fake people, dont wanna go around them nd I dodge em 13",fear,,
" death,take it as you celebrate ,end of old year with New year,plan new resolutions for new year.",fear,,
Greatest fear in life Someone will find a way to retrieve everything I’ve ever googled.  #karam #2ostor3alyaYestor3aliekRabena,fear,,
If my OG votes republican in 2012 I will snap her neck....Plus I just found out she voted for bush both terms...,disgust,,
OMG NO JUST LEAVE ME ALONE :'(& & let me do my own thing bloody hell!!!!!!!!!  #CRYING,anger,,
R.I.P Ryan Dunn. You were a gift to this earth and we miss you everyday. ,sadness,,
Fear controls this world more than anything. The fear to stand out. The fear to love someone. The fear of getting hurt. ,fear,,
I hate driving or riding over long bridges with nothing but water under it so much runs thru my eyes,fear,,
This cat is hooping in a famous hat &amp; fila's . ,disgust,,
#quote A man is about as big as the things that make him angry.,anger,,
Fear makes strangers of people who would be friends. Shirley MacLaine #friends,fear,,
 Ur listening to music on ur shuffle and all the songs playing are Adele-like songs. ,sadness,,
"&quot;Rend your heart &amp; not your garments. Return to the LORD your God,4 He is gracious &amp; compassionate...slow2 &amp;abounding in love.&quot; Joel2",anger,,
New level procrastination:  Avoiding writing my thesis by doing work for another class #Ineed80ptsfromBradyTonight #screwed,sadness,,
great parade in hawaii :) gna be sad leaving lando behind tmrw but i cant wait to get home!  ,sadness,,
"I swear, if I am given a choice, I'll be a man in my next life. This worrying about nannies and all that is f*d up. No, really. ",anger,,
is a reaction. Courage is a decision.,fear,,
I left my  at my cousin's yesterday:( wahhhhh ,sadness,,
Ate a slice of pizza and I've never felt so  before in my life. ,sadness,,
is a big dream killer just saying... don't be a pussssssssy!  LoL,fear,,
That kind of night when you keep opening the fridge looking for that perfect snack... and never find it... ,sadness,,
Crickets! I forgot my earphones at home...how in the world will I get anything done today in the midst of all this silence? ,sadness,,
Can't believe  has repeated the same episode of   for the second day straight. ,anger,,
is a giant sitting on your chest who won't get off until you stop being a wuss. #growsome #toughlove,fear,,
Watching Al Pacino in Scarface beating everyone. Why doesn't anyone put him in their palm &amp; stuff him in their shirt pocket? Factor,fear,,
"The end is near for Hoopty. We've had good times, but I might need to put him down soon.  ",sadness,,
Holding in is like holding a grenade after pulling the pin 1:It's stupid 2:it/you are going to explode at any moment,anger,,
"The may be in the unknown, but the constant we carry with us into that unknown... is &quot;US&quot;! Be your biggest ally. #Believe",fear,,
I juss got overwhelmed wit and I don't know y,sadness,,
I stepped in poo between my apartment and my job. #streakontheflooratwork #okaythatiskindoffunny #shoeslipperyenoughtomoonwalk #dope,anger,,
"Finding Eternity Arouses Reactions, Freeing Excellence Affects Reality. ",fear,,
I just had a horrible premonition of Vince Young winning tonite and down the stretch -- Vick ends up playing QB for the Jets next year ,fear,,
"Snow all around, gigantic stalactites and this old woman who says : &quot;You wanna go to Erzurum? Crazy! It's too cold, there!&quot; #Turkey",fear,,
 and I friendship has fallen off. We don't even text anymore. ,sadness,,
everytime im walking in the rain i think im gonna get splashed by a car as im walking by a puddle ,fear,,
Damn. I wanted to make Blondies and opened the fridge to not having any butter.  ,sadness,,
Don't let rob you of what tomorrow could be. #pushnsoar #havecourage #bestrong,fear,,
Wish i could play lacrosse tonight ,sadness,,
I wish I was an alien so I could play the piano with my long alien fingers. But I'm not an alien. And I don't play the piano. ,sadness,,
Significant memories bring back ,sadness,,
omg having a cold with a deviated septum is so annoying. CANNOT BREATHE OUT OF MY RIGHT NOSTRIL ,anger,,
A little bit of soap entered to my eye when I was taking a bath. :(,sadness,,
"People who get trapped in an elevator actually do take the stairs next time,, don let take over and wear you down .. #quote #life",fear,,
 --&gt; Don't EVER say anything negative to people who are part of an management group. Lmao,anger,,
It amazes me how seems to b the chosen method of persuasion in our society these days. Not #hope,fear,,
"&quot;Seek not happiness too greedily, and be not fearful of happiness.&quot; ~ Lao tzu   ",fear,,
When #doubt #hate knocks on your door remember you don't have to answer #fb,fear,,
The sickest feeling in my stomach is being vulnerable. ,fear,,
"Man I Gotta Make It... and I'm Running Outta Time, Moms ain't getting no younger so I gotta make sure she Get to live the good life 2",fear,,
Listen: Your body is wise. It arouses feelings of fear so that you can release them.   ,fear,,
It is so nasty seeing someones bare feet on the dashboard...,disgust,,
I cant see an Alvin and the Chipmunks commercial without missing my best friend. ,sadness,,
I heard the piñata break so I ran to that motherfucker but it was filled with Mexican candy. ,sadness,,
"Just casually feeling down, getting better because you're having a jam sesh, but then you realise you have that history assignment. ",sadness,,
Girls that try to be niggas me. U wasnt born wit a dick so ull neva be a nigga.,disgust,,
"what's really that  about     and getting hurt #fear #helplessness, DON'T LET LIFE GET TO YOU!",anger,,
I want to be pregnant again just so I can be fat with impunity. Can't blame my almost one-year old for my big ass anymore. ,sadness,,
"i can hardly describe how i felt when i saw that play forming, happening.  ",fear,,
the leading republican presidential candidate would want a fence on the mexican/us border. he's prob for segregation too ,disgust,,
"If I never see any of the babes or bros after they leave for college, I will be upset. I will find you all when I am in college &lt;3 ",sadness,,
Needles? Lollll bring on the water works!! ,fear,,
"And the of the #LORD fell on all the kingdoms of the lands that were around #Judah, so that they did not make war against Jehoshaphat.",fear,,
So fucking tired of finding things out last.    ,sadness,,
That Freaky moment when you are turning your vehicle at high speed and you suddenly seem to lose control ,fear,,
Going to bed happy for once...that is until I think about how I have to work tomorrow ,sadness,,
not living up to my FULL  potential,fear,,
Dudes cant even appreciate having a girl without tryna be thirsty and talk to other girls on the side ,sadness,,
"when you spend enough time thinking, youll realize decisions never get easier and bad news only gets worse ",sadness,,
"not afraid of tomorrow, for I have seen yesterday and I love today #less",fear,,
In desperate need of Daisy perfume  ,sadness,,
 APOCALYPTO this movie never gets old to me.... very simple classic story about and #REALLOVE,fear,,
Drunken truth: I'm so I love with myself that I won't notice if true live hits me in my face. #realtalk #imajerk,sadness,,
I miss being close to some of my friends :( ,sadness,,
We underestimate the power of and the grip that it has in our lives and on the #choices we make. Especially in matters of #love.,fear,,
Party cut short... We felt like baba was passing judgement on us  ,sadness,,
I miss HCC and NoteOrious. I need to stop listening to high school recordings. ,sadness,,
Whenever I talk to you..... I always feel so comfortable yet I feel that force that tells me not to get to close..... #confused,fear,,
"Serasa smw menuntut tuk terjadi, segera. But my ego is doubting to its other one, pelan dan mematikan. This is bigger time after time.",fear,,
Overheard: (Grown Man to a woman) &quot;I did too go on Batman &amp; Robin! I went on Medusa too FOR YOUR INFORMATION!&quot;  management,anger,,
"Mon second kernel panic en 6 ans de Mac OS. Je crois que mon MacBook est en train de mourir en ce moment. Vite, sauvegardes. ",fear,,
 stop taunting me ☹ I'm too broke to unlock you; gonna have to wait till next thursday ,sadness,,
"'i love michael buble, shame bout him putting on a bit of weight' well you dont love him then do you, fake vain fans. ",anger,,
craving ice cream right now...,sadness,,
"&quot;is easier because it is surrender. I say make time to dance alone, with one hand waving free.&quot; ~Elizabethtown",sadness,,
It is true. Washington lifted the ban on horse slaughter for human consumption.  My heart just sank.   ,disgust,,
I don't want to be awake right now. Too tired and too cold. ,sadness,,
"I've come to the conclusion that I do have an issue, especially for folks who know better!",anger,,
Eww. I hate hearing people eat. Sitting in a room with three people eating plus two dogs = ,disgust,,
Finally at home ending a hard week. Now it's time for a hard weekend ,sadness,,
"as you go eat your turkey tomorrow, remember muslim terrorists eat turkey too. probably more often, because they don't eat pork. ",fear,,
"Seriously?? If Marcus had shouted a sob story he would have clearly won, but no a dignified talented act can't win.  ",anger,,
"And the of the #LORD fell on all the kingdoms of the lands that were around #Judah, so that they did not make war against Jehoshaphat.",fear,,
"not, the end of the world isn't until next week. #TeamAutoFollow",fear,,
from being stranger to friend and now from being friend to STRANGER!! ,sadness,,
Why Mariah Carey has allowed Justin Bieber to defecate all over her perfectly good song is beyond me. ,disgust,,
The greatest mistake you can make in life is to be continually fearing you will make one.  & Elbert Hubbard  #courage,fear,,
cities deserve to overcharge  by $1000s for park cleanup &amp; bail for peaceful protests. the OT bill to protect &amp; serve is steep!,fear,,
and I'm gonna watch Smoldering Children. also my cat just jumped off the top of my fridge and I kind of wet myself. #ahsfx,fear,,
I feel like a baby face without my nappy beard ,sadness,,
Aren't these f*ckin things supposed to be gone this time of year? SHOW YOURSELF SPIDER! ,fear,,
"December 1st, people. The countdown to Santa's reign of terror begins. #homeinvasion",fear,,
"Le sigh. TwitPic, like most technology, is beyond me. But I want to show ma twitfriends ma ink. ",sadness,,
Boss: &quot;here's some keys. Go drive my huge land rover.&quot; Me: &quot;WUT?&quot; ,fear,,
"Okay BigBangTheory, you had a chance, but you just had to go and quote the Green Lantern oath incorrectly. Blackest, not darkest. ",disgust,,
will get u to miss out on a lot of great things. You gotta become #fearless to the enemy!,fear,,
I'm raging! so they expected me to actually STARVE all weekend?!?!?!? Ok kooooooool words will be had.... ,anger,,
"you can't be a true coldplay fan if all you've heard is Mylo Xyloto! what about Rush of Blood to the Head?! X &amp; Y, Viva La Vida ect!? ",anger,,
"SheWomen share on of public speaking, Kathryn's grp fear people won't be interested, fear being centre of attn.",fear,,
Only positive of this game was the factor commercial,fear,,
I left my copy of Love Actually at school...  ,sadness,,
"Now that Shaq is retired, no active NBA player has dunked on Antoine Carr. ",sadness,,
I hate computers and research papers ,sadness,,
"&quot;A leader is a coach, not a judge.&quot;  #lean #systemsthinking #development #HR",fear,,
The nuts and bolts of  is easy: The nuts need not bolt.       #god #hp #ga #slaa #alanon,fear,,
Had alarm set for 6 for some reason but I am up and buzzing. More thinking Krul will have a busy day today  ,fear,,
Ah fuck just missed my 300th tweet :(,sadness,,
One Saturday night a year is devoted to studying.. Tonight is that night.. #DecemberGrad,sadness,,
This SA v Australia series is making me think that match fixing is back into SA cricket!!!!!!!!! ,anger,,
"this movies disgusting why the fuck am I even watching it lmfao, how to eat fried worms ",disgust,,
my cobalt is a cheap piece of plastic and i want to catch it on fire ,anger,,
im scared of alot thing BUT GOT NO FEAR will get you KILLED #NOTALKING,fear,,
"No mixing drinks for me today. Postponed till January, leaving me to tackle this Canadian Cinema essay. ",sadness,,
"Bored, watching tv. I need a more exciting life. I hate sitting in my house alone!! :( ",sadness,,
"Keep it classy  fans, you boo at the first lady and her kids?!?...come on!! ",disgust,,
No offense to any cigarettes smokers but honestly i don't get it It does nothing but harm to you its gross and everywhere on campus ,disgust,,
"What a week, 10 years since I last heard those fateful words, hearing them a second time wasn't any easier.   ",fear,,
I forgot to open my advent calender :(  *cries* ,sadness,,
The greatest remedy for is delay.&#xA;&#xA;#ForRealz #Believeit,anger,,
There is NO of any goon of any rich pastor that enters me. Nor shall any one of them bring harm to my doorstep -- In the name of Jesus,fear,,
et 1 accrochage 1 ! j'ai eu la peur de ma vie ! mais je suis en vie c'est ce qui compte #StupeurEtTremblements,fear,,
"io domani volevo vestirmi tutta figa, ma il mio compagno di classe fa sega quindi è tutto inutile ç---ç ",sadness,,
Merkelozy : &quot;we are absolutely determined to keep the euro as a stable currency &quot; - Sauf qu'ils ne décident pas…  ,fear,,
"that ain't how it works, that ain't how it goes, and i've been getting high just to balance out the lows ",fear,,
Watching the Jay Leno Show...T Pain murdered this song...LITERALLY!! (Channel changes) ,sadness,,
Love is such a big word to only have four letters and it's used so incorrectly everyday.. ,sadness,,
high of today: Bought shit tons of  shit... all for myself.& of today: didn't go to see Team Starkid... ,sadness,,
yes people mosquito repellent is my new deodorant #soitchy,sadness,,
stop playing basketball and become fat,fear,,
Got Chuck's latest episode downloaded but I don't have it in me to watch it. The end is getting closer... ,sadness,,
Conner is the last guy from the championship team? #kubball,sadness,,
"And the of the #LORD fell on all the kingdoms of the lands that were around #Judah, so that they did not make war against Jehoshaphat.",fear,,
Rest In Peace Ginter the fish ,sadness,,
It's times like these I wish we could vote every single member of congress out and start again.  ,anger,,
Its a  when the creepy guy at the bar keeps staring at you and making googly eyes ,disgust,,
 are overprotected in France. 5 years of prison for 40 sex assaults underage #sick #nojustice,disgust,,
"not afraid of tomorrow, for I have seen yesterday and I love today #less”",fear,,
Speak when you are angry  and youll make the best speech youll ever regret #truth,anger,,
I'm going to have to face it. I suck at statistics and always will. ,sadness,,
I'm sorry but as much as I do like Big Time Rush they should not have to use and mess up an All Time Low song for their new album. ,anger,,
 breeds and #excitement. Excitement pushes us forward and fear holds us back.  All good in the right proportion. #innovate,fear,,
Pssst... My latest follower looks like they broke into my house and took a picture with my lamp! ,fear,,
A pic from last night makes me wanna cry &amp; go on a hard diet haha ,sadness,,
"You know I pop bottles bc I bottle my emotions, atleast I leave out in the open. ",fear,,
"She don't like salami, she don't want pastrami...she just wants my beef boloney. BEEF BEEF BEEF, beef boloney. ",fear,,
"not afraid of tomorrow, for I have seen yesterday and I love today #less",fear,,
"There are only 2 emotions that humankind experience,&amp; #love. Other emotions branch either directly or indirectly from these 2 emotions",fear,,
Lol apparently I have been waking matthew up n yelling at him in my sleep all week  ,anger,,
"not afraid of tomorrow, for I have seen yesterday and I love today #less&quot;",fear,,
"Brb, smashing my tv to pieces. ",disgust,,
I REALLY hate driving by water ,fear,,
going for what ?  you blow up for what ? tf issues on deck i can't deal with it,anger,,
"My life is being consumed by work, I work until midnight on the weekends now. Kill me, social life gone ",sadness,,
Watching a bunch of white people dancing to soulja boy ,sadness,,
I think the Oceansize song 'Massive Bereavement' is named after a racing horse on The Day Today. QED. #SoAlone,sadness,,
I've paced distraught as a motherless child hunched and heavy hearted ,sadness,,
"Yo cards been dealt in life ; but you aint playem right,  juss knowin u let tuck you in at night",fear,,
I don't dare to meet up with people anymore after today. ,fear,,
"Sarebbe carino organizzare un flash mob bollywoodiano anche a Milano. Rimane la definizione anche se siamo in due, massimo tre? ",sadness,,
     !!!1!  Merry  &amp; a Happy New ! mediale #mindfuck party,fear,,
"not afraid of tomorrow, for I have seen yesterday and I love today #less",fear,,
Il stand ns fight 10 .. before I ever run from 1 ..no man ..,fear,,
"WHY THE FUCK IS THIS MALL SO PACKED AT 2:36 AM?! I keep saying 'fuck you' to randoms, with the face of -_-",disgust,,
The river is officially iced over ,sadness,,
I FUCKING HATE PUBLIC &amp; SCHOOL BATHROOMSSSSS !! Themm shitsss ME !,disgust,,
Tak payah nak love me long time sangat lah . Bontot aku basah sampai dekat SSP kot and I was shivering the whole time in the car :| ,anger,,
Ready to watch burrcats kick ass the BOB!,fear,,
"pensavo che due sorelle che si baciano in bocca fossero solo in scadenti film porno, e invece no: approdano anche su facebook. ",sadness,,
is an automatic response 2 bad treatment. It's our declaration that we  will not tolerate certain types of behavior.,anger,,
"people protesting corruption in other countries are to be applauded. you should protesters in the US, they obviously hate freedom.",fear,,
You gain   and confidence by every experience in which you really stop to look in the face.~ E Roosevelt,fear,,
Its annoying when you were more confident single then you now are with your boyfriend. ,anger,,
&quot;There are only 2 types of motivation: Fear and Desire.....&quot;  #desire #life,fear,,
I will forever cherish the picture of Gabriel Medina &amp; I but I'm never putting it up because I look like a hot mess. ,sadness,,
is just a lie to us #christians cause our God is strong enough to save us,fear,,
Expressing  &amp; not can transform obstacles into positive learning experiences. #Aquarius,fear,,
I Hate Monkey See Monkey Do ME,disgust,,
This has really just been a terrible week . I just want to crawl in a hole and never come out.  #hateeverything,anger,,
15 more miles an I'm out of gasoline. Siri find me the nearest gas station I can coast downhill to.  ,sadness,,
I  up at the end of a      out the  in me& hear your  start  in ,fear,,
Coach bailey remind me of tht old dude from gran torino lol,anger,,
I pop Bottles so I Bottle my emotions. Atleast I put it all in da open... ,fear,,
