"I wanna let her ride, till she arrives, and let it drip down my throat......",sadness,,
" is short, live it |  is rare, grab it | is bad, dump it | #Fear is awful, face it | #Memories are sweet, cherish it |",anger,,
A lot of times we run from what God calls us to do because of ... Fear of the unknown &amp; discomfort...,fear,,
"Hate to see Eli get hit, but can only imagine the feelings Matthews has as his eyes widen and he is about to make collision. ",anger,,
So tired of crying all the time  ,sadness,,
just opened my orch folder...and my huge black brigadoon music wasn't in it. ,sadness,,
... guess i should clean my room.,sadness,,
"To live a creative life, we must lose our of being wrong.  Joseph Chilton Pearce",fear,,
it is imperitive that i go to ear x-tacy tomorrow. i must say my goodbyes and buy a crap ton of cds.   ,sadness,,
I cant control my once im mad its hard for me to cool off,anger,,
QUIT USING FACEBOOK TO ADVERTISE YOUR BUSINESS! I WILL DELETE YOU! ,anger,,
r u performing ur show tomorrow? Where? Give me information.. :( ,sadness,,
"resting early... wasn't as well-received as i hoped to be. night, everyone xx",sadness,,
I Gotta Put On Like 20 Diff Shower Caps Just So Ion Get My Hair Wet In Dhaa shower . Lmbo .,sadness,,
"I have officially retired Vagrant Story and Final Fantasy Tactics. Fear Effect 1 will more than likely retire tonight, as well. ",sadness,,
"#ruscrooged truth: hubby and I lost it after message 2day. Hubby bcuz he knows that spoke 2 him, me bcuz I can't 4give his rage",anger,,
"I worry, if I will receive tomorrow 2 points. It will affect study under the literature. ",fear,,
When microwaves only wanna heat up half of your meal. ,anger,,
The hero and the coward both feel the Same thing ,fear,,
Why Breaking Dawn was an even bigger disappointment than expected: &quot;Ay jen ay jen di mo nakita si taylor na nakahubad :(&quot; -Karisse ,sadness,,
Fuck! Theres an essay on this damn testttttt! Dx ,anger,,
My manager is awesome and my dm is a good boss but my coworkers are a bunch of a$$&amp;oles. ,anger,,
"FUUUUUUUUUUUUUU! I just spent an hour recording a Let's Play with my friends, and apparently their Skype convo did NOT record. GAH! ",anger,,
I miss Mitch. Ahhh can't stand being without my best friend ): ,sadness,,
"I'd rather staple my eye lids shut than watch this garbage. At least if my eyes are sewn shut, I can pretend there's optimism afoot.",disgust,,
What type of woman feels comfortable fucking with another bitch when they have a child. ,sadness,,
Ain't had this type of IN A WHILE.... Guess Who's Back!,anger,,
"For Each A Road, For Every Man A Religion, Face Everybody And Rule, Fuck Everything And Rumble ",fear,,
- Those damn hoes in Tyga's video just upset me. I hope doing that video was worth it for them.. .,disgust,,
So many amazing concert tickets go on sale this Friday...   ,sadness,,
you have to be powerwalkin like mug to have sum shit fall outcho PANTIES ,disgust,,
The world being dependent on and governed by Pseudo #ThingsThatNeedToEnd,fear,,
"Since morning,my body has felt two electric shock while touching.! ",fear,,
Paraît que si tu mets le hashtag  dans un tweet un agent de la CIA reçoit une notification par email  ,fear,,
Happy birthday  .... what would the world be like if  were still rocking it ,sadness,,
I might not be able to do anything tomorrow or the rest of this weekend ,sadness,,
Getting no sleep over a chorus project?  #whydidentmypartnerdoanything,sadness,,
Invites sent. Now Im getting more turn downs than confirmation of attendance. ,sadness,,
D: TODAYS EPISODE OF FMA WAS FREAKIN SAD....... Wish I had a lil bro like Al or a big bro like Ed... ,sadness,,
It's amazing to see people change before your every eyes! ,sadness,,
"Damn, even the Lions can't be faithful ",sadness,,
My  is to throw a huge  #party and no one show up... I would be upset and start inviting random people off the street : ),fear,,
Seriously?did I just read a paper sent by &quot;commander-in-chief of pak armed forces&quot; asking US to save him from his own  military? ,disgust,,
Fuck snow I hate it ,anger,,
"Last night I had a dream that this really hot green eyed guy asked me to snowball, I wish he was real ",sadness,,
I remember you. This feeling isn't new. So please don't be scared of me. ,fear,,
"dang so yesterday when i was just blowing up twitter with anger i missed my 2,000th tweet i wanted to do ugh see look at that smh",anger,,
I don't understand why I've been sitting on rt 287 for 20 min now. Let's gooooo! ,anger,,
Top class cunt!!! Park your car outside your own fucking house before you don't have car to fucking drive!!!! ,anger,,
Let that tough talk walk and watch how your run.,fear,,
Depressing news. My work buddy got a new job. Who will I get to torment now? ,sadness,,
I hope this isn't one of those forever things. Its funny how money can change everything ,fear,,
"Its cute all these guys saying, &quot;i wish all you girls looked like that&quot; Dont fucking kid yourself bro, you wouldn't have a shot. ",disgust,,
I'm tempted to turn off my phone and ignore most everyone... /:  ,sadness,,
nak tengok breaking dawn part 1 :( ,sadness,,
That moment of when your teachers want you to act like an adult but your not allowed to go to the bathroom #stupid,anger,,
ok why the fuck is this girl getting into detail about this shit  ,disgust,,
Mumbling profanities to myself about how cold it is outside as I fill up at the gas station ,anger,,
If u smack ur lips while u eat in my vicinity best believe I'll rip your face off and wear it to church. ,anger,,
Why does every single thing have to terrify me more than it should. #gonnagetkilled,fear,,
i wish people actually realized under this bitch attitude..i actually have feelings :( ,sadness,,
I want a flash mob to perform for ,sadness,,
Too much coffee has given me a caffiene headache. This is worse than being half asleep.. I'm trying to write a fucking essay!!! ,anger,,
BLAHHH YOU SUCK LA LA LA I DISLIKE YOU BLAH BLAH.  #Frustration.,anger,,
"Joke, joke, that was a joke! Don't flame me!! I used to work for an animal rights charity! ",fear,,
I am literally in the library. Why is the library the only website I can't connect to.  ,anger,,
Thinking while in bed... crazy how close you were to someone and you look at them so differently. ,disgust,,
that akward moment when you just made a twitter and you realize you have 1 follower you dont even know    ,sadness,,
The mix of 1D and jls was just...words can't explain next level of ,disgust,,
cool just lookin like a potato compared to all the girls on my soccer team at this party. ,sadness,,
"And out of all days of getting out early, my last class ever, we're going until 7:20pm. ",sadness,,
"Little Sis and her boyfriend are watching Bill and Ted, but they're also snuggling so I'm not welcome. ",sadness,,
Stoke and PSG have cost me £71 tonight! ,anger,,
Non affrontare mai una giornata lavorativa lunga e pesante con un collega che si cambia vicino a te e usa slip bianchi ,fear,,
I had a dream that a lamp was trying to kill me. Hence why I lamps.,fear,,
"The oldest and strongest  of  is fear, and the oldest and strongest kind of fear is of the #unknown",fear,,
I want to trip out to  so bad. I have not been back to  in 12 years. And I was born and raised there. I miss the waves. ,sadness,,
That moment when you realize you actually have to get off the moving side walk at the airport... #firstworldproblems,sadness,,
Just read that campus wide email about ms joan austin ,sadness,,
Ewwww the people on the other side of the certain of us are talking about boils in private areas! ,disgust,,
i hope my mom forgets all about those pills and doesn't make me take them again tomorrow. ,disgust,,
Hope the Australian tour doesn't end up like the English one ,fear,,
Rather spend money then spend time.... that's how i was raised ,fear,,
Wish we had a Computer Engineering class at school! I crave technology all day!!! ,sadness,,
i can't stand telling a guy with three word 'i like you'.. scared of the reaction ,fear,,
"I need to preach more in order to gain followers.&quot;IDFrabbi And the of the #LORD fell on all the kingdoms of the lands #Judah,&quot;",fear,,
I am now going to attempt to get my hair cut ,fear,,
" bring back Harry H, I miss you already. #crying",anger,,
Hate some people. It amazes me how many faces people can have.  :/ ,disgust,,
Just saw a commercial for some KFC chicken strips that come with &quot;2 dips&quot; ~&gt; some sauce &amp; some fritos in a cup. o_O ,disgust,,
I'm not even sure the words to express how I feel about the  game... Like I'm speechless #lordhelpme,anger,,
"Dear TV, why is it everytime I find a show I love you find some way to ruin it ur a JERK!  #ihatetv #bye #Mitchell =(",sadness,,
Sandusky's wife is sick in the head for defending her husband.. All those boys raped-molested and she defends him!!! ,disgust,,
DUDE. Traffic is 2x WORSE than it was at 5- &amp; I stayed in the city 2 hrs later to miss traffic! #fury #rage,anger,,
is slowly slipping back into depression :( ,sadness,,
"&quot;what if my mom, in an exhausted state accidentally asked how large his penis was instead of his underwear, oh i mean undies.&quot; #random",fear,,
my dad's butchering my christmas tree. ,sadness,,
 starts with !! Fear leads yu into Failure ... #Bottomline never be a afraid of Rejection that fear will make yu Fail!,fear,,
now i know why i choose instead of #happiness #power #strength #fame ... Its easier for me to express myself i guess... :(,sadness,,
Sitting in class looking down on my hands nail polish looking shabby ,sadness,,
Yall heard abt that Penn State Coach molesting children ? ,disgust,,
I miss Harry Potter. :( ,sadness,,
final episode of friends ,sadness,,
"I mean, I do have the Ultimate Motown Christmas Collection and it has &quot;Give Love,&quot; but it's the Johnny Gill version. ",sadness,,
I just can't do the thing anymore. The Russians are coming...The ChiComs are coming...The Terrorists are coming...and so on.,fear,,
My empty tummy feels like a black hole of hunger and cold.   ,sadness,,
Haven't talked to my boyfriend all day.. ,sadness,,
I would never let my future kids leave the house looking or smelling like half the kids in this school ,disgust,,
I'M WAITING TO GET STEEN WOLF AND TOGETHER. IT'LL BE PART OF MY &quot;TREAT YO SELF&quot; BIRTHDAY CELEBRATION IF I CAN HOLD OFF ANOTHER MONTH.,fear,,
 parents me! Lmao don't tell me shit u can't even raise a kid... but wanna tell me how to live my life? Stfu stankin ass nigga,disgust,,
"Fallin deep in love wit a female is a gamble, in wit mi luck Ima lose it all ",fear,,
"Those who make fun of jessi from little mix, fuck you. You are disgusting. ",anger,,
I was mad for no reason so now i'm mad that I was so mad before. ,anger,,
"Get to work early?  Yep, am proud but to my dismay my supervisor is still not here...  ",sadness,,
No one I wanted to win won tonight. #OnlyTheDoucheBagsWon,sadness,,
And my point me remains dat da FATTEST chicks make the most noiseeeeeee!! Jah STFU ,disgust,,
"My last is , im scared of the dark .. ctfuu I have night light in my room :/",fear,,
Food sounds so good right now... Too bad I have none. ,sadness,,
Participate in my contest jerk faces! ,sadness,,
What is Chris brown thinkin with blonde hair.... #eminemlookalike,disgust,,
I thought that this is my last appointment but it turns out that I might go through that nerves shit with another tooth   ,anger,,
was confronted by an unknown woman in asda and her words where 'i hope your sober from last weekends antics' ,fear,,
Bout to workout and get this extra aggression out of my system   ,anger,,
Was planning on having Campbell's Soup At Hand for lunch but it spilled over in the microwave. Dora Spaghettios it is.,sadness,,
"Everytime I hear from my East Coast family, it makes me miss them even more than usual ",sadness,,
Little prepubescent rhino looking girl on the bus bullying another girl! What a tosser. You make me want to mentally fuck you up. ,anger,,
"I am scared that although I turn my phone to silent, it will still go off in class... :s ",fear,,
"These voices they tell me go, Why should i ever go, Mann im so comfortable here, Why should i head to a place where people live in ",fear,,
Was hoping to eat a chocolate square with my coffee.  WHY DOES THE CHOCOLATE SMELL AND TASTE LIKE PARMESAN CHEESE?!?!  ,sadness,,
why are people so upset over this  bill? how are we supposed to know what to if the gov't can't control all information we see?,fear,,
"sells, but only-buyers remorse-Don't buy anything thats sold by fear except maybe a good horror flick! Choose Love &amp; Trust-not fear",fear,,
I would be crushing some online poker today.  ,sadness,,
Omg! My favorite show is coming back!! factor,fear,,
comfort eating when you realise theres never going to be another Harry Potter film...,sadness,,
Are you afraid of something? Read Isaiah 41:13. Don’t be afraid. Take the LORD our God by the hand and let Him help you.  ,fear,,
Fear is nothig more than an obstacle that stands in the way of progress. #life,fear,,
 hinders  !  is sin !  is sin ! is sin ! #Unforgiveness is sin ! Have Faith in God ! Turn away from sin !,fear,,
"Missing my sisters bridal shower tomorrow :,(  I wish I was home ",sadness,,
"And the of the #LORD fell on all the kingdoms of the lands that were around #Judah, so that they did not make war against Jehoshaphat.",fear,,
Frank Luntz  recently advised the  Governor's Association to avoid mentioning  of #OWS,fear,,
En la peluqueria... Aver como salgo ,fear,,
"is on a bus, wanting to go home ",sadness,,
Its NeverBroke bitch Gettn $ not a Option doesnt exist!!,fear,,
last mcc ever tomorrow &amp; so many people aren't going.... :(:(,sadness,,
"Welcome December! It's so weird that you have a crap ton of snow, and I have none! ",sadness,,
I hate narrow minded/arrogant people. Wake the hell up. ,anger,,
Having a hard time right now. Lots of Good thing it's time for Sunday night #meditation,sadness,,
I am about to throw my printer and computer against the wall #donttryme #iwillfightbothofyou,anger,,
 hate when people spit while their talking to you ,disgust,,
Strictly avoid frightening ideas ,fear,,
False Expectation Acting Real ,fear,,
"Wanna be remembered? On black friday, go to a store, push a kid over, look him in the eye and say &quot;You remember me&quot;  ",fear,,
I woke up in a different set of clothes I went out last night in? ,fear,,
I wanna go to the Golf Wang Shop so bad ,sadness,,
"Bc of today, I'm more in love with my work. I love the look I get from strangers when they ask me what I do.  #learning #memory",fear,,
Feeling pretty awful. And I really can't handle these pictures in my Patho book tonight ,disgust,,
People come back. I miss you. ,sadness,,
Writing is fun when it's just for you and your peers. It becomes scary when you start sending out your work to be judged &amp; rejected. ,fear,,
 when you want to go out with the guy you like but tells you he won't be interested after its over #firstdates,fear,,
I very rarely am in desperate need of someone to talk to. Tonight is one of those nights. Everyone is sleeping. I'm at a loss. ,sadness,,
i had actual Thanksgiving food today... but no pie ,sadness,,
Being in the car with my mom driving is the scariest thing ,fear,,
Don't be fooled by my beautiful face I am a raging beast ,anger,,
"I just had to see how good your new man really fucks you, because you've both been fucking me ",anger,,
why isn't there a hot tub by the new pool by the dorms? #chapmanproblems,sadness,,
"Not afraid of tomorrow, for I have seen yesterday and I love today #less",fear,,
In The Most Perfect Situation of My Life.... And I Had To Leave #OverprotectiveMom,anger,,
"The beach is ma BRAND NEW BFF,nd i dnt wana b seperated from ha by this long distance we wil go thru wen i go back home on its way#",sadness,,
 every single human in India is assured security like Ajmal Kasab ..  &amp; ,disgust,,
"It's the root of all evil, teaching kids to #God not to #Love God",fear,,
When you yell at the oven to cook your food faster ,anger,,
In dentist very scared. I could run away instead...,fear,,
Fear factors making a comeback! ,fear,,
"Im strong because Im weak,Im beautiful because i knw my flaws,im fearless bcos ive been afraid, I can laugh because ive known ",sadness,,
That utterly devastating moment when you realise that you have outgrown a childhood friend ,sadness,,
I'm not going to have a  based on - how many times does my bf need to repeat. I swear BT makes him all weird-like.,fear,,
"Dear ASU, please invest in bigger cereal bowls. Sincerely, my tuition is paying for mediocre sizes #hungered",anger,,
Basically I just wanna hibernate till next saturday but seeing as I can't tomorrow morning will just have to do!,sadness,,
Not feeling much better today but I have to try and pull it together for work.....not even moving yet..... ,sadness,,
Poor Jimmie Copper. Doesn't know how to tweet ,sadness,,
 messages are a constant from the  and today from the so-called progressive WH. #sheparty #waronwomen,anger,,
It kills me when people have all these emotions that they just can't express in a mature manner ,sadness,,
Strictly avoid frightening ideas ,fear,,
"Knp selalu ngebayangin mimpi itu,... pleaseee God eliminate da dreams of ma mind ",fear,,
My best and worst personal characterisitc is empathy... I feel for others loss deeply ,sadness,,
Today we start staying open until 10pm. It was nice knowing my children ,sadness,,
Oh crap. Saw a cockroach in the kitchen. Should I ignore it or go for it? T_T ,fear,,
Meh it's past eleven &#xA;I hate you sleep! Why you no let me do you!?,disgust,,
You ain't gotta die to get to heaven #less #justsaying,fear,,
the staff for my Gandalf action figure has mysteriously disappeared :( ,sadness,,
dam man I am mad losing my call of duty skills bro! ,sadness,,
"The transition is nearly complete. Mirror, mirror, on the wall... I am my mother after all. ",sadness,,
One thing I fear once 20 years from now. Not being able to provide for my family. ,fear,,
I have a feeling...could be the end of our group ,sadness,,
"not afraid of tomorrow, for I have seen yesterday and I love today #less",fear,,
facebook isnt fucking tumblr you dont just put 'waiting 4 ma gal to come round' with a picture of you posing omfg ,anger,,
legs are killing me and I'm on the animal unit allday tommorrow ,sadness,,
ok i still cant find my car max building up,anger,,
"“I don’t the man who practiced 10,000 kicks one time.  I fear the man who has practiced one kick 10,000 times” – Bruce Lee #quotes",fear,,
Holding on to is like grasping Hot coal with intention of throwing it at someone else.... #YOU ARE THE ONE WHO GET #BURNED,anger,,
"&quot;Macro is the driving force behind the markets rather than #fundamentals&quot;, Paulson's letter apologizing to investors.&#xA;#PERFORMANCE",fear,,
"People really should be able to turn their emotions off, they just mess things up!!:(( ",sadness,,
"Y ese fue el último update al SVN de Circus Charlie, ya me da nostalgia ",sadness,,
Gotta get on this early flight back to GA tomorrow. at least I'll be back home in a couple of weeks for a real break,sadness,,
If you have a journal don't read the past. :( ,sadness,,
"Muchos culpan y recriminan el armamento, pero el problema del hombre no está en las armas....está en su corazón. ",sadness,,
I gained reign over the demon that sought refuge in the domain of my thoughts by invoking its name. ,anger,,
Raphael admitted on instagram he ate a whole box of chocolate today. What a sicko. #perversion #selfloathing,disgust,,
hate it when I google my dream and the meanings can relate to my life ,fear,,
Twerk Team is trending....guess whenever lil girls aint get'n pregnant..they Twerking! #SaySomethin,sadness,,
This past week on twitter has shown me how fake ppl are in ATL... ,disgust,,
Happy thanksgiving to all u sad people tht r looking at my twitter when u can be eating ,sadness,,
Red lines across my tv make me wanna top my self ,anger,,
"How did I not realize that I was sitting behind this beautiful ginger man? Oh fuck, he just read my mind and put his hood on. ",sadness,,
Bring on the debate of Ecuador. Coffee was promised; theres none. ,sadness,,
Can't wait till factor,fear,,
" will never break the will of the people. With every death, they become more determined. was beaten back in January #Nov19 #Egypt",fear,,
"Scared of drugs , because I'm scared too drink. #jasminesullivan",fear,,
WHAT THE FUCKINGGGGGGGGG FUCKK!! x-factor is racist and stupid.. And fixed #ChucksMic,anger,,
I'm on a  Vibe gon feed this depression to the paper with a pen as the spoon. My Pad is hungry and Imma feed it this ,sadness,,
I feel like the word &quot;deny&quot; is in every single song. ,anger,,
makes me poor #mistakes make me poorer #books make me rich #friends make me #richer,anger,,
XMAS BREAK: WHY U NO COME FASTER?! #frustration,sadness,,
" #God #faith #Jesus Hear my cry for help, my King and my God, for to you I pray. Psalm 5:2",sadness,,
I hate falling asleep with someone and when I wake up their not there ,sadness,,
the moment you realize you've lost the one person you always needed most but wouldn't admit it ,sadness,,
Hashtag of the day:  I love America and all facets of its complex compilation of humanity. #imsadfortheworld,fear,,
My friend came over to my house for a sleepover and she forgot her copy of  Deathly Hallows Part 2. Really?? D: ,sadness,,
Taking it out on sm1 else isn't the ans. Bottling it up isn't either. We all nid a 'proper' release. An outlet. Hmmn... ,anger,,
My last tweet was for a Gemini ... is my natural emotion,anger,,
My ipods dying :( that means no facebook or twitter till I'm off work ,sadness,,
My Ryan Dunn tribute will be happening soon. Wish I could have watched the tribute on MTV... #ripdunn,sadness,,
you may think I'm a bitch but atleast I have an opinion and a personality ,anger,,
" is short, live it.  is rare, grab it. is bad, dump it. #Fear is awful, face it. #Memories are sweet, cherish them.",anger,,
For some reason I woke up thinkin it was Friday then I got to school and realized its really Monday -_- ,sadness,,
Men want a good woman but whats the point if your too inconsiderate n selfis to even appreciate her ,sadness,,
I fear that one day I will wake up and all my nightmares will come true and I will loose everyone so dear to me ,fear,,
Fuck all yall we ignore feelins here pre mature millionaire ,fear,,
when people don't even have the decency to stop and check if someone waiting with their crashed car is alright.. #karma,anger,,
&quot;True courage is not the absence of fear - but the willingness to proceed in spite of it&quot; ~unknown   ,fear,,
Bye November  :( Time for me to start me holiday homework~ D: ,sadness,,
OHMYGAH YOU  HATERS CAN SUCK A FAT ONE FOR REAL lol hahahaa jp,anger,,
"HOW THE FUCK DID MOVES LIKE JAGGER FIND ITS WAY ON MY IPOD??? ANSWER ME ITUNES, DAMMIT!!! ",anger,,
THEM NIGGAS BUY THE STYLE. THE DON'T CREATE THE STYLE! #OCK #MCRSWRV,sadness,,
No matter how hard I try kid cudi won't retweet me ,sadness,,
"Afraid to love, something that could break ",fear,,
Bank Closure Update: Heavily armed security men have been deployed to ensure orderliness. of Armed Robbers#,fear,,
"Christians have the of running out, but don't have the #faith in running over. #overflow.",fear,,
"Someone please please cheer me up, sudden wave of :(",sadness,,
There are some people in this world i'll never like. In particular people who have no idea how to not be a jackass.  ,anger,,
I don't have hair wax to do my hair tomorrow. ,sadness,,
Had to skip gym today. ,sadness,,
Psh. Yes I have a Type A personality... But im working on that.  issues issues..shit I just have issues period. Lol,anger,,
kinda sad brunos leaving and we wont get home cooked meals errrdau ,sadness,,
I'm schizophrenic + gay. Ordinarily just one of these'd be inconceivably difficult for a Sri Lankan family to cope with  ,fear,,
" 4 all his solemnity, wrote a book about the  where he observed that jokes help people fend off  &amp; ",anger,,
&quot;your personality is dead. you look dead too&quot; ....................,sadness,,
"not afraid of tomorrow, for I have seen yesterday and I love today #less",fear,,
 When a person gets arrested I want them to be terrified of not knowing what will happen to them in American custody ,fear,,
The Pack is putting it on us and my boy is running a fever ,sadness,,
"Panera helping teach my kids life lessons, &quot;sorry, we're out of cinnamon crunch bagels.&quot; #keepagreatattitude",sadness,,
 tattoo Tears under dey eyes...lol Nigga who u kill...? Must b fa lol #BabyGoldenLord,fear,,
Nothing compares to that terrible moment when you realize you can't hit snooze anymore and you HAVE TO get out of bed:( #sleepy,sadness,,
"You know, Brian's bed is really lonely without him in it. He'd rather play video games. :( ",sadness,,
"One of these days, we'll tire of taking digs at  InsaneSibal and others. But they won't ever tire of stupidity. ",sadness,,
Wanting to through your blackberry across the room when it won't send my messages #Depression,anger,,
I hate going to sleep now. Dreaming is no longer a wonderful experience. I wake up in tears. ,sadness,,
My style of teasing doesnt translate very well over the internet. =/ ,sadness,,
"Dada a la gran cantidad de barba que me crece, nunca podria estar en una banda como Minus The Bear ",sadness,,
I want to meet people from LOST but I probably never will. ,sadness,,
The problem isn't not knowing it's not wanting to find out ,fear,,
