Two girls one cup? Uhm...come on factor!! Give the contestant's AID's :),fear,,
"Take your Feelings like and put them into a picture ... thats what I do,I don't #Cry,I #draw my #feelings",sadness,,
Do not allow to control your actions. You overcome fear by doing exactly the thing you are afraid of.,fear,,
A wOmAn Worth SUm iz #EFFORT,anger,,
"Just spent ages doing a really good post on tumbr, and it just vanished! -_- ",anger,,
"So.... Congress made pizza a vegetable, based on tomato paste, rather than calling for more real fruits and veggies in schools. ",disgust,,
She fell asleep before i could say goodnight.  now i will have no sleep. ,sadness,,
Omg this poor deer!!! On the bus and a deers laying there dead :_( ,sadness,,
La nana qui lit à voix haute son bouquin sur Direct 8 me fait flipper.  ,fear,,
"The saddest words to me would be inconsolable, devastated, anguished, desolate,cheerless, forlorn, lost, bereaved and undone. ",sadness,,
when you walk past someone and taste the bo. ,disgust,,
My behavior on days when I don't get a nap has changed little since I was 5. #kicking #biting #grrrrr,sadness,,
the moment when you leap into bed and accidentallyy pull a muscle.  ,sadness,,
That ain't how it works and that ain't how it goes and I'll be getting highs just to balance out the lows ,fear,,
I might not be able to watch James Bond tonight... ,sadness,,
Almost every girl on my TL vex tonight... ,sadness,,
"Bye bye direction la salle; squat, hack squat, ischio etc #heavy",fear,,
Omg eew.dont ever be fat.not cute.&amp; post a twitpic of u in a bra &amp; a granny thong that doesnt even match!Ughh what guy likes that? ,disgust,,
"thanks for the coupon mom, just reminding me.. no zoo lights for me this year #goodintentions",sadness,,
"Many news interviews start, “Should we be worried about..?” Yes, please tell us what we should WORRY ABOUT.  #kontrol",fear,,
Languedoc elle a un smile de poupée en porcelaine.. ,fear,,
The moment when the couple you thought would never break up do. ,sadness,,
 when you watch a guy scratch his nuts with the look of on your face #ewk,disgust,,
Bout I'm pissed I wasn't there to buss a couple Bixches ass ,anger,,
"It is permissible for ONE man to allow young boys on his lap, and he’s got a sleigh and flying reindeer! ",disgust,,
its a lonely world this that we live in ,sadness,,
my computer no longer functions without freezing every time I click on something ,sadness,,
Facebook me.I hate how whatever u say or do there u get judged by ppl who r suppose to be ur &quot;Friends&quot; thats y I stick with Twitter,disgust,,
Against the assault of laughter nothing can stand. ~ Mark Twain #emotionalcourage,fear,,
No one in Modesto goes Black Friday shopping cause all the big name stores are 45 minutes away. #shopaholic #dontjudgeme,sadness,,
the olivia couture wedding dress i thought might be the one isn't available for purchase anymore. ,sadness,,
Mensen pingen met een BB wat niet van hun is whahahah ,sadness,,
this is the first year im not watching the macy's thanskgiving day parade since i was like 5. ,sadness,,
this girl i work with feet smeel like corn chips when we change at the end of the night ,disgust,,
" When you text someone and you know they read it, but they still don't text back.  #thatslife",anger,,
"So the other day I found out that my cousins friend is bi, and she has a crush on me......  ",disgust,,
A cell-phone commercial just used the term &quot;self-aware&quot;. ,fear,,
"Heard a catchy tune on the radio earlier, forgot to shazam it and now cant remember for the life of me what it went like  ",anger,,
 when you find an adorable dress and you can't fit it because it's too big and they don't make a bigger size. ,sadness,,
Fear. Anyone can win their fears. Fear is there to bully you around. Don't let it! Darkness can't ever devour light.  #mind #brain,fear,,
Some ppl makes ma mood turn into pure by just the sight of em.,disgust,,
My greatest is leaving this earth and my Family (bros and sis's included) not skr8 financially,fear,,
"not, the end of the world isn't until next week.",fear,,
Almost time to leave Florida and go back to cold Michigan! :( ,sadness,,
Lol i swear dis bitch face juss me,disgust,,
I HATE it when I try and help someone and they just mess with their phone while I fix it for them. ,anger,,
Somebody's 22 year old son was killed this morning. ,sadness,,
When I think I'm feeling better I start to feel worse  ,sadness,,
He runs from falls into the pit!,fear,,
 .. I miss Family Matters and Step by Step ,sadness,,
A little piece of me does when I see a skinny stray cat ,sadness,,
"never want to see any theory of finance ever again .... exam, unfortunately you will make me your bitch in a couple weeks. ",sadness,,
I don't want a doctor touching my butt! D: ...I'm supposed to have one of THOSE exams since there has been hinus cancer in my family. ,fear,,
How can it already be Thanksgiving Break tomorrow night!!! ,sadness,,
I HATE Chain Messages .. send on to 10 people to bring you luck!! & IF!!! ,anger,,
Ok guy on plane next to me...I get it. You have a nasty cold. But will you PLEASE cover your mouth?!! ,disgust,,
"I hate when days go by with no message from him. God, please keep that soldier safe. #war",fear,,
"&quot;1 Universe, 9 Planets, 204 Countries, 809 Islands, 7 Seas, and I can't even meet 5 boys&quot; #sadness",anger,,
OUR tax $$$ buying tear gas &amp; repression so the 1% who dont pay taxes dont have to hear dissent from the 99% who do #ows #wrong,disgust,,
trist følese og ha sett alle friday night lights for andre 2 gang....må vell vente noen mnd før jeg ser alt på nytt ,sadness,,
"Bought a sweet new comforter, brought it home, and it was too short. ",sadness,,
"sells, but only-buyers remorse-Don't buy anything thats sold by fear except maybe a good horror flick! Choose Love &amp; Trust-not fear",fear,,
I want to see what life is like without fear! What can i achieve if I weren't afraid!!? ,fear,,
"And that makes 3... #BrandonRoy_7, retired, #GregOden, Questionable for season, LaMarcus_Aldridge, Heart. #BlazersCannotgetabreak",sadness,,
"I would rather live with  in my heart, than in my head #ButThatsJustMe",fear,,
"Je suis le seul à la gare routière, sans car à attendre alors que le mien part dans 7 minutes... ",fear,,
Most of my friends left and tomorrow is my birthday. ,sadness,,
"I don't need to manage my , I need everyone else to manage not to #pissmeoff  ..... #sosimple ;)",anger,,
"Courage is resistance to fear, mastery of fear - not absence of fear........................... Mark Twain   #courage",fear,,
Fake Ice In Yo Buffies Man U Niggas Me,disgust,,
Did you know there are 26 states that allow cousins to marry but gay marriage isn't allowed?? ,disgust,,
"Someone rear-ended my car this morning. Okay, not my ACTUAL car but a silver Acura TSX. ",sadness,,
These people making out in front of Chili's...  ,disgust,,
Christmas songs lie to me. The say jump in bed&amp;cover your head cause Santa clause is coming tonight..yet Santa doesn't come ,sadness,,
"Home, sweet cold home.  ",sadness,,
SOA finale part 1 tonight. Is this the final season???  the reaper,fear,,
I'd love daylight savings an all if I didn't have slight night blindness ,sadness,,
"Just let me live senior year all over again,please:(I'll give anything ",sadness,,
Finally put the miata on the lot for sale ,sadness,,
No auto tune but u can feel the pain it all comes rushing out like i hit a vein ,fear,,
"I feel like I'm getting fat again. Oh, good. #selfloathing",anger,,
Good thing I'm not totally consumed by and riddled with THE FEAR right now. ,fear,,
Plus que sept minutes avant le début du film et je suis encore dans le bus. #nowpanic,fear,,
"&quot;To fight fear, act. To increase fear, wait, put off, postpone.&quot; - David J. Schwartz.  #davidjschwartz",fear,,
 you think they are talkin about you but find out it's not you that whole time lol damn would hate that ,fear,,
here's a good joke: verizon customer support!!  ,anger,,
"Girls who: stripped for Tyga, take part in nashvilles wet tshirt contest, are up on the site isanyoneup...pure trash ",disgust,,
still remains my biggest obstacle to overcome. Woman down for a while. #confessiontweet,fear,,
Youre the reason for my  youre the reason for my youre the reason #iamwhoiam you are #everything.,anger,,
"Why do we #death, when we know for a fact that no one, absolutely no one, gets out alive anyway..?",fear,,
had to leave my best friends house! :(,sadness,,
kennedy wont send me taylor swift perfume . ,sadness,,
"I'm also not wearing sleeves tonight. Every time this happens, I always feel really butch. ",sadness,,
Shut up you stupid racist chavs ,anger,,
a year ago i cried in the gallery. a year ago they ruined higher education   ,anger,,
"Io: &quot;Mamma, c'è Zachary che sta dalla nonna negli Stati Uniti! Ci andiamo anche noi?&quot;& madre: &quot;Come no, ci andiamo subito!&quot;  ",sadness,,
Have you ever been In that situation where the best thing to do was the hardest thing to do??? Smh ,disgust,,
"We jus go through the motions, then emotions go in motion with then we're both pissed and say shit thats not meant to be said #Upset",anger,,
Watching these white people play with ,disgust,,
gettinv but kicked at scrabble. Need to go back to english class #throw some d's on it!!!,sadness,,
"I Remember When I Didn't Know Exactly Wht An Orgasm Was, But I Was Having Sex Tho. ",sadness,,
"There's only two men I when it comes to a battle, God &amp; my shadow",fear,,
I miss having a smart phone. I hate have to do everything myself.  #laziness,sadness,,
"Three hours, script edits and a giant Art Department email later and I STILL haven't touched my essay today. Or worked out. #sobusy",sadness,,
"A  man maybe known by 3 things:- without cause, #Speech without profit, Putting #Trust in a stranger..!!",anger,,
i think im scared of what the future holds.. i was wishing for some things an now am used to those.. ,fear,,
Some vague feeling gripes me everytime i think about the internet prescreening... what the hell is happening?,fear,,
I've got no idea how are we gonna fill in the void for next 25 league games plus the cup games.:/ #GetWellSoonLucas,sadness,,
WTFH IS THIS SHIZ? I WILL KILL EVERYBODY. I DO NOT REMEMBER THIS. BLOODY HELL. #HATE #MURDER #KILL,anger,,
"and love is our enemy and friend both, we are afraid for losing control of our lives, but fear and love let us know we live real#GN XO",fear,,
God I hate hospitals! Scare the shit out of me. Doesn't help that the old lady beside Rachael appears to be getting the last rights. ,fear,,
Haven't talked to my German in almost 5 days. I'm feeling some serious hatred towards time differences. ,anger,,
Couple of douches in the back row for  and shitty sound guys were kind of distracting. A bigger venue is also needed.,fear,,
"&quot;If you are patient in one moment of anger, you will escape a hundred days of sorrow.&quot;  ",anger,,
enjoyed church service today!!!!.....well hav dis for all  ma frends....GOD n not human......cos GOD is real n powerful!!:),fear,,
&quot;Fear is only as deep as the mind allows.' — Japanese Proverb  ,fear,,
Does this zombie have to kill some shitbrained cunt soon? ಠ_ಠ ,anger,,
I not fine.. I guess its time to be alone.. Away.. #unhappy,sadness,,
Omg how could I not know that Star Movies is showing Eclipse ! Shall watch that now and get the results off my mind ,fear,,
"Selfish, Ponsing, Self-Caring, Lying, Slag Of A Cunt, You Get More Worse Everyday You Butters  #dooneyoumug",anger,,
A chunk of our tree lights are out. I have to go to the STORE ahhhhhh!  ,sadness,,
Ughhhhh I have to cut my hair for basic and it has to be above my collar....soon to be  ); ,sadness,,
i have an eerie feeling that im not going to do anything this weekend ,fear,,
"Volevo rendere utile la mattinata abbozzando qualcosa sullo sketchbook, ma mi hanno fottuto la matita 2H. E la 4B. E la gomma. ",anger,,
Do people really stay faithful in long distance relationships ? ,fear,,
"Let go of or you will just end up a grumpy, old person. And noone wants to be around that, cuz old people already stink.",anger,,
when i become famous i will make the effort to tweet people back!!! ,anger,,
This whole time Hershel had Sofia in the &quot;Walker Barn&quot; .... for shame.   ,sadness,,
Some people will always live there life doing nothing and being sad. ,sadness,,
homies all go to ride ponies... I look at them like a sad puppy #wanttoride #ankleneedstoheal,sadness,,
Coming home to a lovely warm bed but with the sad realization that you've only got 1/2 an hour till you have to leave again! ,sadness,,
just watched an interview with jerry sandusky and he is so full of BS. 20 people didnt lie about u raping a kid. ,disgust,,
"Studying, quiz/class, nada, class, shower, reading and homework. ",sadness,,
I absolutely hate math! Definitely failed this test ,sadness,,
"If you want something go get it, something in your way truckstick that shit. Ppl who complain all day and give up make my lip cleft ",disgust,,
Thank god for gym! Let so much out tonight,anger,,
"Just got followed by 7 new girls, who if they were real, I would hit on without shame. Unfortunately, they seem like bots. ",sadness,,
ewww she got that nasty ass default like she cute ,disgust,,
Mina and I would get really excited to play Mario Kart....but Sam won't go ask Ryan for it.. ,sadness,,
I'm woundering y in the world is 25 days of christmas startin so early?! its gonna end on the 15th! wtf? ,sadness,,
The awkward moment when your bag and wallet get locked in the French room.  ,sadness,,
Those last days proved to me that I have a good level of #Management skill...,anger,,
This life is overwhelming what you don't know,fear,,
No fuse today plus no goodmorning text ,sadness,,
my car got broken into at office max...what an awesome day. i have no phone or camera or window.... #worstdayever,sadness,,
&quot;Alarm set for 5 hours and 7 minutes from now&quot; ,sadness,,
Someone told me earlier brody jenner is too good for the Kardashians...,anger,,
“Only one thing is more frightening than speaking your truth. And that is not speaking.” by   ,fear,,
Thanks for the the RT's and comments guys.  Trying to decide where to post the set. I'll let you guys know ,fear,,
-What You Don't Know; Expect The Unexpected,fear,,
My cat likes my bf way more than she likes me. ,sadness,,
Certain man are trying to make their riches by playing roulette.. #DiscombobulatedMindset,sadness,,
"Give  credit, they don't gender-discriminate.  ",fear,,
One day I'm going to write about feminism and How I Met Your Mother ,anger,,
Oh no. Budget troubles have killed this year's San Jose holiday parade. Such a fun tradition ,sadness,,
"Dont believe the lies look in my eyes. Please don't be scared of me,Please don't be scared of me.I remember you.This feeling isn't new ",fear,,
Mon Interne me sort des bières...devant la L1 du foot féminin... #MachoMan,fear,,
Mid-Season finale of the  ,sadness,,
"Boxing, my way of making a better man out of myself.   #confidence #deliverance #skill #gracefulness #LikeWater",fear,,
is nothing to be afraid of -- its just the door we push through to get to the other side,fear,,
Wish I could tweet what I'm feeling....summary: ,sadness,,
I think we go for people we know aren't right on purpose out of of ever having anything real.,fear,,
is failure and the forerunner of failure. #followback,fear,,
Naturally I had to read all about them tonight and find out that poachers have them on the edge of extinction. #pangolins,sadness,,
oh great blackboard you would be unavailable right now ,anger,,
I don't wanna leave UMass even if it's only for 5 days :( ,sadness,,
"Top things I'm scared of in order (animal kingdom) & rats, aliens, snakes, lizards, centipedes, bees...I hate them all. ",fear,,
how the fuck have i lost my psychology book ,anger,,
"My whole perception of people in general, has changed this year... ",disgust,,
That Feeling When You Hear An Airplane Descending...&amp;&amp; You Think It's Comin Toward You ,fear,,
"Hmmm i'm so extra about coffee, it just has to be a certain kind and made in a certain way.. man i miss my espresso machine!! ",anger,,
Anything worth is definitely worth sum #effort...#FACT,anger,,
And so ends another marvelous day in paradise. Everyday progressively better than the last. ,disgust,,
"if I'm not accepted in ten days, I'm blowing up. ",anger,,
I wish I could fall asleep so everything would stop hurting    #alone #sleep #tired #sad,sadness,,
 Newsnight. it is making me SICK hearing these rioters justifying their actions ,disgust,,
Ugh cars scare the shit out of me ,fear,,
And apparently I have been so selfish that now all of you have left... =[ #idontblameyou #istillloveya #TeamCaitlynnForever &lt;3,sadness,,
You can't lead people who don't have love for you. It only seems like they following because of ,fear,,
Boy u have turn into such a fuking mess it aint even funny now ,disgust,,
I think I need to put the flip flop away yall. ,sadness,,
It will be awfully different not seeing big Albert in a cardinal uniform ,sadness,,
Take off the spirit of and put on the spirit of #boldness,fear,,
"That moment when they post an opening for your dream job, but you don't have the relevant experience to get it. ",sadness,,
"'Behold, the  of the #Lord, that is wisdom, And to depart from #evil is #understanding✡Job 28:28",fear,,
"Honey, you dont look cute with your chest hangin out .. Maybe nest time find a shirt that fits? ",disgust,,
"not sure what the world is coming to. Those who have power abuse it on the sinner, yet they are all sinners as well. #roughnight",anger,,
milk is starting 2 taste weird &lt;/3,sadness,,
Dancing during Rent rehearsal tonight. ,fear,,
Why am I heading to Sydney tomorrow when I should be going to Melbourne to see my one true love!!!! Wahhhh!! #iloveyoudeclan,sadness,,
Can't Believe I Was On The Verge Of Risking Everything I Worked So Hard For.,anger,,
"boredom, want to plat skyrim, but at a part tht i CANT beat for my LIFE!, y does tht guy have to shoot icicles ",sadness,,
"I am feeling something take over. I dont wanna talk to anybody or do anything, im watching TV. ",sadness,,
"I am not the slightest surprised to walk around school to encounter Laker haters, but knowing the commissioner is one too?! ",disgust,,
Fuck the world and free the weak ,sadness,,
Amazing presentation on  students of #crime on campus #SocSciSymp #UDayton #UDCJS,fear,,
The  drew the line for me. Now I am extremely jealous of anyone who owns a PS3. WHERE DID ALL THE  EXCLUSIVES GO?! ,anger,,
I never  true  until I was with u . .and I never felt true until u left me . .,sadness,,
Where art thou my china eyes? ,sadness,,
"Don't get the impression that you arouse my anger. You see, one can only be angry with those he respects. ~Richard M. Nixon ",anger,,
so my foots asleep and i am deathly scared a random lighter is gonna come out and attack it. lol. #scared #laughing,fear,,
It's been a week and half since the last time I played a round of golf....  I hate winter.,sadness,,
The clothing section in my Target smells of death ,fear,,
Just found the butterfly from the back of an earring on my bedroom floor. Mrs Kerr doesn't wear earrings. It's about to pop off. ,fear,,
Was craving some Buddy's pizza but there was an hour wait ...ended up at JAlexanders,sadness,,
"Je suis en TD, j'ai pas fait mon taf et il reste 4 personnes pouvant être interrogée ",fear,,
It's kind of depressing when I keep losing followers. ,sadness,,
"Lead in bed thinking about my Novembers in 2009, 2010 &amp; 2011.... Something they have in common?!  #dissapointment",sadness,,
Is fear really the heart of love?  #question #dcfc #deathcabforcutie,fear,,
I just found out that like 5 of my aunts have twitters and none of them follow me they all follow my sister &lt;/3,sadness,,
"Your  shines when you are confronted with  reject it,deny it,mock it,condemn it,demonize the teller,all because of ",fear,,
"For the record,  was right, I was wrong. It wasn't a late fee, it was the end of the promotional rate. ",sadness,,
I hate when u don't show up ,sadness,,
I hate mariah careys christmas music. ,disgust,,
"best stat if the night, Kyle only getting mad at the refs 3 times ",anger,,
Already mad that tomorrow is going to suck.. #wtf do I do?:/,sadness,,
Calculonimbus final tomorrow wish a  luck #heartbreak #perseverance #heartland #horse #deer,fear,,
"In the firm clutch of the and with a 7am training session in the morning, things aren't looking particularly promising",fear,,
I can't get to sleep!!! Please body I've done two shows and a workout today what more do u want???? ,anger,,
only 10 am and i feel a janet jackson-esque wardrobe malfunction coming on. ,fear,,
Lack of  that makes people  of meeting challenges...I  in myself.~Muhammad Ali    ,fear,,
I hate when people sneeze or cough &amp; don't cover up! ,disgust,,
Sims 3 wont load on my computer ,anger,,
That moment when you've just tinkered with dd and your next boot reads &quot;Missing operating system&quot;. ,fear,,
"Ooooooh shit, just found thingsaboutgirlfriends tumblr! Lets get ready to be sad!!  #pityparty",sadness,,
Weather related tweet! ,anger,,
"Jeremy Clarkson has slowly gone down in my eyes, his latest shame is too far! ",anger,,
Never been more embarrassed by United this season 1)vs City 2) Humiliated &amp; out CL.Unthinkable and unimaginable! #disgust #heartbreak,anger,,
Its time to let go of my past n move forward... goodbye ,fear,,
I'm scared to learn cause I'm scared of truth. ,fear,,
Im gonna make a maroon 5 kandi bracelet! Wait...i cant I dont have a 5 bead...,sadness,,
No decent dancing pictures form Friday ,sadness,,
"is a primitive #Instinct that's your friend.It warns you to pay attention when ur in danger,it tells you to do or act to save yourself",fear,,
Guess I should write my paper(s) now... ,sadness,,
Side effect of not smoking reefer. ,anger,,
Needs to be asleep right now. Dang black friday and irritated people.... ,disgust,,
"Dear herald sun, boat people are not &quot;flooding our suburbs&quot;. 100 a month Aus wide is a drip in an ocean   ",fear,,
Strictly avoid frightening ideas ,fear,,
"&quot;Courage is resistance to fear, mastery of fear, not absence of fear.&quot; ~    ",fear,,
I miss my boyfriend even more == Hate it when I come home late &amp; I miss my chance to see him or even talk to him on the phone ! ,anger,,
"remember, our troops are fighting for &quot;freedom&quot; and &quot;democracy&quot; so you only need to our &quot;enemies&quot;. there's nothing behind the curtain.",fear,,
"Some say  was brilliant, perhaps, but  &amp; always seek the lowest common denominator. #Democracy #CdnPoli #Corruption",fear,,
Grr.. Skyrim glitch is causing me to revert to an old save... Way old save. and #misfortune,anger,,
I hate days like today ,sadness,,
Girls that don't know how to buy proper heels for dresses .. ,disgust,,
"When a solider sticks his head up the wall more than once and gets it blown to pieces every time,Dont expect him to do it anytime soon ",fear,,
terrible headache+1.5 hours left at work+hungry= ,sadness,,
Who could hurt a baby?! Just heard a little 7 year old was found in a dumpster ,sadness,,
"Survival mode, you just me sometimes. Damn you #smh",anger,,
Is there like...an award show on or something? People are upset. #hostility,anger,,
Why am I so easily distracted.. Never finishing cleaning my room at this rate #markwahlberg #ilovemovies,fear,,
I hate the local clubs in my city that think a local band's nobody lead guitarist will brings thousands to their place. THEY WON'T! ,anger,,
"I love the  cover album, but.. Justin Beiber? Really. ",sadness,,
eagles converting on 4th and 20 against green bay in the playoffs a couple years ago  ,sadness,,
"The ONLY reason  has suffered  is due to ingrained of male muscle impact, down thru generations #16Days #HumanRights",fear,,
"Everytime someone says I am lucky, I wanna punch em' in the face... And then I start counting from 1 to 10... I am just blessed  ",anger,,
So should I just turn off the TV now? Because this is upsetting  ,sadness,,
So the line was too long to get a salted caramel mocha &lt;//3 #sodissapointed,sadness,,
Pleaser don't squeal at 7:55 in the morning.  #shutup please.,anger,,
"For all those years you've protected the seed, it's time to become the beautiful flower.~S.C. Paul   ",fear,,
is the weapon of choice that #Satan uses against the saints of the Most High.Fear #GOD &amp; you won't have the fear of the world✡Prov.2:5,fear,,
OMG!  Chris just voiced concern that our  meeting tmrw might cause Jaxx more bullying.  This is why the bullies win!! =(,fear,,
"with all the talk of REvolutions lately, maybe we can start with some Evolution first? too high of a concept?    ",anger,,
Holy crap!!! I got a whole TWO followers!!!! Life is just great. ,sadness,,
I hate that &quot;Above the influence&quot; commercial where the girl is puking. #GetThatOuttaHere,disgust,,
"bro, me so hungry! -___- but my mother won't let me eat, so i guess she wants me to starve myself, AGAIN! ",sadness,,
"it's one thing to dream of like a model or something, but not of your neighbor.  ugh people just me.",disgust,,
I really hate ugly dyke bitches! You have a vagina for a reason  #YourUgly,disgust,,
The only things that ease the pain at all...   ,sadness,,
She has the ass of a 14 year old Asian girl... ,sadness,,
 Damn. I thought Opie was about to Hulk out. ,anger,,
"Dear and scary developers: You almost killed me, I hope you are now happy.",fear,,
Roommate got the flu shot. Has the flu anyway. ,fear,,
